{
  "Type": "Room",
  "Subtype": "Hearth",
  "Name": "Liquid Hearth",
  "Rules": "",
  "Mana": 0,
  "Cards": 0,
  "Defence": 1,
  "Treasure": 2,
  "Roads": ["N","E","S","W"],
  "Slots": [
        { "1": [ ["Magic", 0], ["Magic", 0] ] },
        { "2": [["All",0]] },
        { "3": [] }
        ],
  "Background": "./backgrounds/Liquid_Hearth.png"
}
