{
  "Type": "Room",
  "Subtype": "Hearth",
  "Name": "Demonic Hearth",
  "Rules": "",
  "Mana": 0,
  "Cards": 0,
  "Defence": 1,
  "Treasure": 2,
  "Roads": ["N","E","S","W"],
  "Slots": [
        { "1": [ ["Demon", 0], ["Demon", 0] ] },
        { "2": [ ["All",0] ] },
        { "3": [] }
        ],
  "Background": "./backgrounds/Demon_Hearth.png"
}
