{
    "Type":"Room",
    "Subtype": "Basic",
    "Name":"Witch Chamber",
    "Rules":"",
    "Mana":0,
    "Cards":2,
    "Defence":1,
    "Treasure":3,
    "Roads":["N"],
    "Slots": [
        { "1": [ ["Wild", 0] ] },
        { "2": [ ["Magic", 0]] },
        { "3": [] }
        ],
    "Background": "./backgrounds/Witch_Chamber.png"
}