{
    "Type":"Room",
    "Subtype": "Basic",
    "Name":"Lava Pool",
    "Rules":"[Demon] & [Mana]: Add [Demon] to your Domain",
    "Mana":4,
    "Cards":0,
    "Defence":2,
    "Treasure":0,
    "Roads":["N","S"],
    "Slots":[
        {"1":[ ["Demon", 2]]},
        {"2":[]},
        {"3":[]}
    ],
    "Background": "./backgrounds/Lava_Pool.png"
}